,speaker,sentence,lang
136,LETTER,"En effet, selon les images de synthèse présentées, l’on pourrait croire que l’édifice faisant office de « flèche » à l’entrée autoroutière obstrue de façon importante certaines perspectives – notamment, vers le sud, une magnifique vue sur le sigle lumineux Farine Five Roses.",fr
137,LETTER,"De plus, les usagers des voies maritimes et ceux des installations faisant face au bâtiment se voient privés d’un important accès visuel à leur ville.",fr
138,LETTER,Montréal désire simplement s’assurer que l’édifice envisagé sur l’îlot de la Commune est fidèle aux principes que s’est elle-même donné la SHM en matière de respect du patrimoine urbain et de qualité architecturale.,fr
139,LETTER,"Présidente du GPAT Rose-Marie E. Goulet, artiste en art visuel Les membres du comité GPAT sont : Simon Brault, président de Culture Montréal et directeur général, École nationale de théâtre",fr
140,LETTER,"Dinu Bumbaru, directeur des politiques, Héritage",fr
141,LETTER,"Montréal Philippe Côté, Atelier du patrimoine urbain de Montréal Michel Des Jardins, directeur, Imago André Dudemaine, directeur, Société pour la diffusion de la culture autochtone / Terres en vue Anne-Marie Jean, directrice générale, Culture",fr
142,LETTER,"Architectes Sandra O’Connor, directrice des communications, Culture",fr
143,LETTER,"Michel Sabourin, président du Club Soda et président de la Corporation de développement urbain du Faubourg Saint-Laurent 8Annexe",fr
144,LETTER,Principes directeurs du Comité sur les grands projets et l’aménagement du territoire (GPAT) de Culture,fr
145,LETTER,La contribution réelle du projet au développement culturel de la ville a.,fr
146,LETTER,"une préoccupation authentique à l’égard de la créativité, des arts et des enjeux culturels aux différentes étapes de développement du projet",fr
147,LETTER,"Valorisation d’une approche interdisciplinaire et transdisciplinaire par opposition à une approche trop spécialisée, fermée ou exclusive.",fr
148,LETTER,c. Prise en compte des éléments patrimoniaux et identitaires.,fr
149,LETTER,Vision du développement culturel et artistique à long terme sur le site choisi.,fr
150,LETTER,e. Impacts sur les créateurs et les organismes artistiques et culturels déjà établis sur le territoire choisi.,fr
151,LETTER,L’apport du projet à la réalisation d’objectifs collectifs reconnus a. Prise en compte des objectifs des politiques de développement culturel ou du patrimoine de la ville.,fr
152,LETTER,Contribution à la réalisation des grands objectifs du Plan d’urbanisme de la ville.,fr
153,LETTER,c. Conformité avec les objectifs de la Stratégie montréalaise du développement durable.,fr
154,LETTER,d. Prise en compte de la Charte montréalaise des droits et responsabilités des citoyens.,fr
155,LETTER,Les retombées sociales et économiques du projet,fr
156,LETTER,Inclusion des jeunes et des citoyens de diverses origines ethnoculturelles.,fr
157,LETTER,"Contribution au développement de la créativité, au partage des savoirs et à l’employabilité à l’échelle locale et municipale.",fr
158,LETTER,c. Retombées économiques pour les quartiers environnant le site retenu.,fr
159,LETTER,Connexions entre le projet et la population du quartier.,fr
160,LETTER,Les bénéfices urbains du projet a. Contribution à la réappropriation des lieux et valeur identitaire du projet;,fr
161,LETTER,"Valorisation d’usages quotidiens, saisonniers et permanents des installations;",fr
162,LETTER,c. Amélioration de la qualité des espaces publics;,fr
163,LETTER,d. Relations entre le projet et le développement d’autres espaces de la ville.,fr
164,LETTER,"La contribution du projet au développement durable a. Degré de prise en compte des facteurs environnementaux ( énergie, écologie, eau, transport ).",fr
165,LETTER,Caractère exemplaire du projet et des innovations qu’il comporte.,fr
166,LETTER,c. Obtention des certifications et des témoignages de reconnaissances recherchés.,fr
167,LETTER,La qualité du processus de développement du projet a. Transparence et présence de mécanismes d’évaluation indépendants.,fr
168,LETTER,Qualité de l’accès à l’information.,fr
169,LETTER,c. Prise en compte réelle de la participation des citoyens et des résultats des consultations publiques.,fr
