,speaker,sentence,lang
313,LA PRÉSIDENTE,"Sur la question des clientèles, mais sur la question des transports, je vais dire ceque j’ai dit à monsieur Hanna, ça sera pour la séance du 1er décembre.",fr
314,MME SOPHIE THIEBAUT,"Bien, je vais poser une deuxième question, puis je vais garder ma questionde transport pour le 1er décembre.",fr
315,MME SOPHIE THIEBAUT,"Donc, on nous a dit que la Société du Havre était un organisme sans but lucratif,qu’elle ne dépendait pas de la Ville de Montréal.",fr
316,MME SOPHIE THIEBAUT,"Alors, j’aimerais ça savoir c'est qui lesmembres de la Société du Havre et à qui elle est redevable?",fr
317,M. GAËTAN RAINVILLE,La Société du Havre est redevable à son conseil d'administration qui est composéde 11 membres dont 10 proviennent de l’entreprise privée et qui est présidée par madameIsabelle Hudon.,fr
318,M. GAËTAN RAINVILLE,"Maintenant, nous sommes redevables – et moi, personnellement,contrairement à ce qui a été évoqué tout à l’heure –, nous produisons des états financierset nos derniers états financiers datent du 30 avril de cette année, ils ont été vérifiés pardes vérificateurs externes.",fr
319,M. GAËTAN RAINVILLE,"Donc, une affirmation qui a été faite tout à l’heure n’était pascorrecte.",fr
320,M. GAËTAN RAINVILLE,"Et nous sommes redevables, parce que nous utilisons des deniers publics quandmême, au public.",fr
321,M. GAËTAN RAINVILLE,Et je voudrais juste faire une petite correction qui est importante à mon avis.,fr
322,M. GAËTAN RAINVILLE,il n’y a pas 65 000 véhicules qui passent par jour dans l’axe.,fr
323,M. GAËTAN RAINVILLE,Il y a 65 000 déplacementsdont au-delà de 40 000 sont des usagers des autobus.,fr
324,M. GAËTAN RAINVILLE,"Donc, il y a à peu près 20 000,10 000 le matin et 10 000 le soir automobiles dans le corridor.",fr
325,M. GAËTAN RAINVILLE,"Alors, c’est beaucoup moinsque j’espère...",fr
326,MME SOPHIE THIEBAUT,"Mais c'est vraiment pas grand-chose quand on compare avec les autoroutes quipassent sur Turcot, là.",fr
327,MME SOPHIE THIEBAUT,On s’en reparlera au niveau des coûts qu’on met là-dedans.,fr
328,LA PRÉSIDENTE,", s'il vous plaît.",fr
329,M. SAMI HAKIM,"Avant de commencer, j’aimerais juste apporter une brèvecorrection.",fr
330,M. SAMI HAKIM,"Pour ce qui est des états financiers, ils n’ont jamais été disponibles sur le siteweb de la SHM.",fr
331,M. SAMI HAKIM,"Il y a un onglet qui indique les états financiers, mais quand on le clique, ilne fonctionne pas.",fr
332,M. SAMI HAKIM,Cet onglet apparaît seulement dans la version française.,fr
333,M. SAMI HAKIM,"Madame la Présidente, je fais partie d’un groupe de citoyens au Griffintown qui esttrès affecté par les effets néfastes qu’aura ce projet, particulièrement sur la qualité de vieet la santé des Griffinois.",fr
334,M. SAMI HAKIM,"La zone d’étude de la SHM s’étend de 3 coins de rue à l’est desa zone d’intervention jusqu’à la rue McGill, mais ne s’étend pas du tout vers l’ouest, c'està-dire du côté du corridor d’autobus sur Dalhousie et du quartier Griffintown.",fr
335,M. SAMI HAKIM,"Madame laPrésidente, je ne veux pas savoir pourquoi nous ne faisons pas partie de la zone d’étude,mais puisque notre environnement, notre santé, notre économie seraient affectés par ceprojet, la SHM peut-elle redéfinir sa zone d’étude afin d’y nous inclure?",fr
336,LA PRÉSIDENTE,C’est votre première question ou c’est votre seule question?,fr
337,LA PRÉSIDENTE,Vous désirez qu’on y réponde immédiatement avant votredeuxième?,fr
338,M. SAMI HAKIM,"S'il vous plaît, oui.",fr
339,LA PRÉSIDENTE,sur la définition de la zone d’étude.,fr
340,M. GAËTAN RAINVILLE,"La réponse est oui, c’est certain qu’on pourrait augmenter la zone d’étude.",fr
341,M. GAËTAN RAINVILLE,"Maintenant, c'est certain que ça va induire des délais, ça va de soi, au niveau de laréalisation.",fr
342,M. GAËTAN RAINVILLE,"Les raisons, à l’époque, pour lesquelles cette zone-là n’avait pas été incluse,c’est que premièrement, au sud, le projet de Devimco dans Griffintown était un projet quiétait sur la table et qui était très vivant et qui était imminent en termes de réalisation.",fr
343,M. GAËTAN RAINVILLE,"Au niveau nord, il y a l’ÉTS qui déjà prend une bonne partie du territoire et qui esten expansion également.",fr
344,M. GAËTAN RAINVILLE,"Il reste effectivement des terrains vagues situés entre la rueWellington ou entre la rue Ottawa, plutôt, et la rue William au nord.",fr
345,M. GAËTAN RAINVILLE,"Et en gagnant versPeel, on ne va même pas jusqu’à Peel pour voir des terrains qui sont développablesvraiment.",fr
346,M. GAËTAN RAINVILLE,"Alors, c’est parce qu’il n’y avait pas suffisamment de potentiel de développementet il y avait déjà beaucoup à faire dans les autres secteurs.",fr
347,M. GAËTAN RAINVILLE,"Ce n'est certainement pas parmépris, ni par un manque de préoccupation de notre part sur le développement del’arrondissement Sud-Ouest et principalement de la partie nord de Griffintown.",fr
348,LA PRÉSIDENTE,"Monsieur Hakim, pour votre deuxième question?",fr
349,M. SAMI HAKIM,Ma deuxième question porte sur le moratoire sur les contrats deconstruction.,fr
350,M. SAMI HAKIM,"Le maire, il a déclaré un moratoire sur tous les contrats accordés par la Villetant que la lumière ne se fasse pas sur les rumeurs de collusion dans la construction.",fr
351,M. SAMI HAKIM,Maiscela n’empêche pas la Ville à octroyer des fonds à la SHM pour qu’elle aille ensuitechercher des contrats de construction.,fr
352,M. SAMI HAKIM,"Madame la Présidente, est-ce que la SHM al’intention de suivre l’exemple du maire et d’attendre que toute la lumière soit faite sur lesrumeurs de collusion dans la construction avant d’accorder plus de contrats?",fr
353,LA PRÉSIDENTE,"Je ne sais pas si monsieur Rainville a une réponse, mais on sort du projet deQuartier Bonaventure dans le présent cas.",fr
354,LA PRÉSIDENTE,Vous amenez un élément politique là.,fr
355,M. SAMI HAKIM,Il y aura des contrats de construction qui seront...,fr
356,LA PRÉSIDENTE,"C’est une question à adresser au maire de Montréal, probablement.",fr
357,M. SAMI HAKIM,"Si vous permettez donc, j’ai une autre question qui ne porte pas du tout sur lapolitique.",fr
358,LA PRÉSIDENTE,"Si c'est une question d’intérêt général, s'il vous plaît.",fr
359,M. SAMI HAKIM,"Madame la Présidente, le vidéo de la SHM nousannonce que le Quartier Bonaventure se voudra exemplaire en termes de développementurbain et durable, mais le but du développement durable est de trouver un équilibrecohérent et viable à long terme entre trois enjeux : économique, social et environnemental.",fr
360,M. SAMI HAKIM,"Le prix du projet, il a triplé depuis son annonce.",fr
361,M. SAMI HAKIM,"Les riverains au Griffintown ont étéignorés malgré leurs efforts, et le projet multipliera par 4 les émissions de CO2 auGriffintown.",fr
362,M. SAMI HAKIM,"Quand elle néglige autant les contribuables que les riverains, je vousdemande comment la SHM compte-t-elle trouver un équilibre à long terme entre les troispaliers du développement durable?",fr
363,LA PRÉSIDENTE,Je demanderais encore une fois à l’assistance de retenir sesémotions.,fr
364,M. GAËTAN RAINVILLE,"Bien, Madame la Présidente, c'est vraiment une de nos préoccupations defaire de ce projet-là un modèle de développement durable.",fr
365,M. GAËTAN RAINVILLE,"Et nous sommes tout à faitconscients que le développement durable, c'est l’équilibre entre différentes fonctions, entreles fonctions économique, sociale et environnementale comme le souligne monsieurHakim.",fr
366,M. GAËTAN RAINVILLE,"Maintenant, j’entends des données qui me surprennent, nous disant qu’on aurades émissions de gaz à effet de serre qui seront, je ne sais pas, 40 fois, ai-je entendu, plusélevées que maintenant dans Griffintown?",fr
367,M. GAËTAN RAINVILLE,"Je ne sais pas sur quelles données de tellesaffirmations reposent, j’aimerais qu’on me les produise parce que je pourrais donner desréponses plus intelligentes.",fr
368,M. GAËTAN RAINVILLE,"Maintenant, quand je dis que le développement durable nous interpelle vraiment,c’est que – vous aurez l’occasion de le voir davantage jeudi soir lors des présentations surle milieu de vie, sur la qualité de vie qu’on recherche pour le Quartier Bonaventure – qu’ona à tous niveaux, que ce soit au niveau des aménagements des espaces publics, que cesoit au niveau de notre conception de ce que pourront être les bâtiments qui seront érigéssur les différents îlots, sur la végétation, sur la lutte aux îlots de chaleur sur les passagespiétons qu’on veut aménager, sur la qualité de l'air, on s’est préoccupé beaucoup et on afait faire des études sur la qualité de l'air et sur les effets que pouvait avoir l’environnementimmédiat en termes de nuisances pour les êtres humains qui y vivront et qui y travailleront,alors c'est une préoccupation constante, et je le répète, on va persister dans ça.",fr
369,LA PRÉSIDENTE,"Non, s'il vous plaît.",fr
370,M. SAMI HAKIM,"... je n’avais pas dit 40 fois, j’avais dit 4 fois.",fr
371,M. SAMI HAKIM,"Et je ne parlais pas de GES, je parlaisde CO2, c'est-à-dire un gaz à effet de serre que l’étude de qualité de l’air n’a pasconsidéré.",fr
372,LA PRÉSIDENTE,"J’appellerais maintenant monsieur Silviu Bursanescu, s'ilvous plaît.",fr
373,M. SILVIU BURSANESCU,", je suis un habitant du nord de Griffintown, la partie nord, sur le développementLowney de Prével et la réponse que monsieur Rainville vient de donner à la premièrequestion de monsieur Sami Hakim m’a pour le moins surpris parce qu’on apprend de cetteréponse-là qu’il n’y aurait pour le moins aucun développement là, puis aucun terrain viablepour développement à l’ouest du viaduc ferroviaire du CN, alors que c'est pour le moinsinexact parce que le développement...",fr
374,LA PRÉSIDENTE,Je vous demanderais de réserver vos commentaires pour la période desmémoires.,fr
375,M. SILVIU BURSANESCU,"Tout à fait, mais c'est la partie introductive que je garde courte, mais ça amène maquestion.",fr
376,M. SILVIU BURSANESCU,"Donc on est – juste pour conclure sur ça, il y a 700 unités de Prével et c'est unprojet qui existe depuis 2002.",fr
377,M. SILVIU BURSANESCU,"Donc dans ce cadre-là, ce que je me demande, c’estcomment ça se fait que dans les études qui ont été réalisées par la Société du Havre etégalement dans le rapport qui a été produit en juin dernier, on ne parle jamais du projetPrével et des impacts que le projet Bonaventure dans son entier, mais particulièrementégalement le corridor qu’on propose de faire passer dans le quartier auront sur le Lowneyavec quelque 1000 habitants de ce développement-là, et donc comment ça se fait qu’il n’ya pas de consultation?",fr
378,LA PRÉSIDENTE,C’est votre première question.,fr
379,M. GAËTAN RAINVILLE,Ce n’est certainement pas parce qu’on ne s’intéresse pas à l’existence et audéveloppement du complexe Lowney de la firme Prével.,fr
380,M. GAËTAN RAINVILLE,"C’est tout simplement qu’aumoment où on a reçu le mandat d’aller de l’avant avec ça, c’était un projet qui était déjà enmarche et qui était en développement, qui était déjà très avancé et certaines phasesétaient même habitées.",fr
381,M. GAËTAN RAINVILLE,"Maintenant, les études d’impact, moi, je rappelle une chose très simple.",fr
382,M. GAËTAN RAINVILLE,"C’est quedans le choix que nous préconisons pour faire un corridor exclusif au transport collectif quiest Dalhousie, présentement, la situation actuelle, c'est que les autobus passentexactement sous les balcons des gens qui habitent la Lowney, c'est-à-dire sur la rue del’Inspecteur, à partir de la rue William jusqu’à la rue Notre-Dame.",fr
383,M. GAËTAN RAINVILLE,"Nous, on a pris grand soin, beaucoup de souci à essayer de déterminer un corridorpar lequel on pourrait éloigner les autobus justement de ces résidences-là.",fr
384,M. GAËTAN RAINVILLE,"Et quand vousregardez une carte géographique, vous pouvez voir qu’on éloigne effectivement d’un îlot lecorridor d’autobus du corridor présent.",fr
385,M. GAËTAN RAINVILLE,"Et j’ajoute juste le fait suivant aussi à la réflexion,c’est que ce corridor d’autobus là empruntant la rue de l’Inspecteur a été décrété parl’Agence métropolitaine de transport au tout début de l’année 2004, et depuis cetteépoque, les autobus passent à cet endroit-là alors que certaines résidences de la Lowneyne sont habitées que depuis quelques années, sinon quelques mois et d'autres enconstruction.",fr
386,LA PRÉSIDENTE,Aviez-vous une deuxième question?,fr
387,M. SILVIU BURSANESCU,"Non, mais pour conclure, je dirais qu’on se propose quand même de passer d’àpeu près 300 autobus par jour dans le quartier à 1600, et sur un nouveau corridor qui n'estpas celui que l’AMT avait proposé à l’origine.",fr
388,LA PRÉSIDENTE,Je demanderais encore une fois à la salle de...,fr
389,LA PRÉSIDENTE,"Je demanderais madame Natacha Alexandroff, s'il vous plaît.",fr
390,MME NATACHA ALEXANDROFF,J’ai une grande page toute gribouillée puis je vaisessayer de m’en sortir rapidement.,fr
391,MME NATACHA ALEXANDROFF,"Moi, je suis résidante de Pointe-Saint-Charles et ons'est battu pour qu’on respecte le patrimoine matériel et immatériel.",fr
392,MME NATACHA ALEXANDROFF,"Quand on dit« matériel », c’est la façon de vivre des gens, c’est aussi le côté visuel aussi.",fr
393,MME NATACHA ALEXANDROFF,"Bien là, c'estmatériel, mais enfin, on ne peut pas toucher – un paysage, on ne le touche pas",fr
394,MME NATACHA ALEXANDROFF,"Quand moi je viens de l’extérieur et que je prends le pont Champlain et que je voisMontréal, selon la saison, c’est vert, ça peut être rouge, orange, c’est d’une splendeur etquand je vois ça, là, moi, je pense que les gens qui viennent d’ailleurs, ils ne viennent paspour voir quelque chose comme ça qui ressemblent à New York.",fr
395,MME NATACHA ALEXANDROFF,Ils viennent voir Montréalcomme Montréal est maintenant.,fr
396,MME NATACHA ALEXANDROFF,Et on nous met quelque chose dans les yeux.,fr
397,MME NATACHA ALEXANDROFF,"On diraitqu’on a pris l’autoroute qui est en largeur et puis à l’horizontale, puis on l’a mise à laverticale.",fr
398,MME NATACHA ALEXANDROFF,"Je trouve que votre projet est très beau par rapport à la façon dont il est proposé,les liens que vous avez faits, mais la hauteur des bâtiments me laisse perplexe.",fr
399,MME NATACHA ALEXANDROFF,D’autantplus qu’on s'est battu à Griffintown pour baisser les bâtiments.,fr
400,MME NATACHA ALEXANDROFF,"Et, moi, à Pointe-SaintCharles, je regarde ça puis je sens que ça nous arrive à toute vapeur...",fr
401,LA PRÉSIDENTE,Je vous demanderais – c’était votre préambule?,fr
402,MME NATACHA ALEXANDROFF,"Oui, oui, c’était mon préambule",fr
403,LA PRÉSIDENTE,Je vous demanderais d'arriver à vos questions.,fr
404,MME NATACHA ALEXANDROFF,"Moi, ce que j’aimerais aussi",fr
405,MME NATACHA ALEXANDROFF,", Madame la Présidente, c'est la maquette qui est enavant quand on arrive ici, c'est une maquette qui donne une fausse impression d’équilibredes hauteurs, parce que dans cette maquette-là – et c’est à peine perceptible par lescouleurs",fr
406,MME NATACHA ALEXANDROFF,"– on a rajouté des immeubles qui ne sont pas là actuellement, qui ne seront peutêtre jamais là, qui ne sont pas sur des plans, de chaque côté de l’autoroute Bonaventurealors qu’on ne les voit pas.",fr
407,MME NATACHA ALEXANDROFF,"Alors, on les a...",fr
408,MME NATACHA ALEXANDROFF,"Bien, la question, c’est que moi j’aimerais que ces immeubles-là soient identifiés àla prochaine rencontre qu’on va avoir pour que les gens qui se penchent dessus puissentvoir que ces immeubles-là n’existent pas actuellement.",fr
409,MME NATACHA ALEXANDROFF,"Griffintown, comme il est montré làdessus n’existe pas et si on les enlève, vous allez voir que ça, ça a l’air de tours beaucoupplus grandes que ce qu’elles sont maintenant.",fr
410,LA PRÉSIDENTE,"Monsieur Rainville, est-ce qu’il est possible d’identifier les immeubles dontmadame...",fr
411,M. GAËTAN RAINVILLE,"Bien, ils sont déjà – maintenant, je comprends que ça puisse ne pas êtreperceptible pour tout le monde – ils sont constitués d’une essence de bois différente, pluspâle.",fr
412,M. GAËTAN RAINVILLE,"Tous ceux qu’on a mis comme des bâtiments, soit qu’ils répondaient déjà à desprogrammes particuliers d’urbanisme et qui avaient été adoptés ou encore au zonageactuel.",fr
413,M. GAËTAN RAINVILLE,On a imaginé justement un cadre bâti qui pourrait apparaître dans les années àvenir.,fr
414,M. GAËTAN RAINVILLE,"Et ça pourrait être, Madame la Présidente, identifié de façon différente.",fr
415,MME NATACHA ALEXANDROFF,"La deuxième question, je... bon, je trouve, écoutez, l’architecture, pour unearchitecture moderne, c’est splendide, je vous tire mon chapeau",fr
416,MME NATACHA ALEXANDROFF,", c'est très beau ce quevous avez fait.",fr
417,MME NATACHA ALEXANDROFF,"Mais je me demande pourquoi dans un cas comme celui-là où je medemande si ça va être dans ce qui s’en vient, est-ce qu’on va pouvoir permettre de faire unconcours d’architecture pour qu’il y ait différentes visions et qu’il y ait différentescompagnies qui puissent nous proposer quelque chose.",fr
418,MME NATACHA ALEXANDROFF,"Parce que ce n'est pas tout lemonde qui a le regard architectural et puis qui est capable de dire : « Ça, c’est trop, c'estpas trop ».",fr
419,MME NATACHA ALEXANDROFF,Il faut qu’on donne aux gens la possibilité de choisir quelque chose qui leurcorrespond.,fr
420,LA PRÉSIDENTE,"Monsieur Rainville, sur la possibilité qu’il y ait un concours d’architecture?",fr
421,M. GAËTAN RAINVILLE,C’est une possibilité qui est à l’étude présentement.,fr
422,MME NATACHA ALEXANDROFF,"Je voulais juste vous dire un tout petit dernier point, s'il vousplaît, au sujet du New City Gas.",fr
423,MME NATACHA ALEXANDROFF,"Vous savez, la roche noire qui se trouve – vous savez oùse trouve la roche noire?",fr
424,MME NATACHA ALEXANDROFF,"Vous savez combien il y a de gens qui passent tous les jours devant, qui nesavent pas ce que c'est?",fr
425,LA PRÉSIDENTE,"J’inviterais monsieur José Serrano, s'il vous plaît.",fr
426,M. PIERRE SAINT-CYR,Je suis un résidant – un autre – du projet Lowney.,fr
427,M. PIERRE SAINT-CYR,"En fait, je veux ce soirsouligner le travail colossal qui est devant nous.",fr
428,M. PIERRE SAINT-CYR,"C'est le fruit de plusieurs années detravail, puis c'est un travail qui aura un impact déterminant sur Montréal, on en est bienconscient.",fr
429,M. PIERRE SAINT-CYR,Ce que madame Hudon a dit tout à l’heure est extrêmement intéressant.,fr
430,M. PIERRE SAINT-CYR,"C’est quece soir, contrairement à d’autres projets, on a l’impression qu’on est à un stade d’avantprojet assez avancé, mais qui a quand même une porte à des améliorations.",fr
431,M. PIERRE SAINT-CYR,"Et c'est dansce contexte-là que je vous demanderais, en fait, que la commission demande àl’",fr
432,M. PIERRE SAINT-CYR,"Sud-Ouest si c'est possible de verser, pour la gouverne de lacommission, au dossier, justement l'ensemble des sommaires décisionnels, l’ensembledes décisions du conseil d’arrondissement du comité exécutif qui sont relatives aux 7phases du projet Lowney.",fr
433,M. PIERRE SAINT-CYR,l’expression qui a été utilisée tout à l’heure –d’avoir une vision globale.,fr
434,M. PIERRE SAINT-CYR,"Autrement dit, avoir une documentation qui est relative à ceprojet, projet important",fr
435,M. PIERRE SAINT-CYR,"– j’ouvre la parenthèse et je vais la refermer rapidement, on parlequand même de 700 unités de logement, c’est entre 25 et 35 % de ce que monsieurRainville a identifié comme le potentiel du Quartier Bonaventure, donc c'est quand mêmeimportant – alors si, pour les fins de la réflexion des travaux des prochaines semaines cesdocuments-là étaient versés, en fait, on pourrait comprendre le cheminement quel’arrondissement Sud-Ouest, lui, a pris face au développement de ce morceau de ville quiest à l’ouest du viaduc ferroviaire et, finalement, de le mettre en perspective avec toutl’ensemble du travail qui est fait par la Société du Havre.",fr
436,LA PRÉSIDENTE,"Je vous remercie, Monsieur Saint-Cyr.",fr
437,LA PRÉSIDENTE,"La demande est reçue, ça a été noté, çasera déposé à l’ensemble des travaux de la commission.",fr
438,LA PRÉSIDENTE,J’appellerais maintenantmonsieur Zavin Darakjian.,fr
439,M. ZAVIN DARAKJIAN,"Je suis résidant du Griffintown puis le bassin Peel, et puis ça fait 38 ansque je suis là comme commerçant et résidant, puis ma famille maintenant – nous sommes4 – nous sommes là.",fr
440,M. ZAVIN DARAKJIAN,"Je suis aussi un survivant de leucémie, j’ai eu le cancer, the bloodcancer, et puis je suis très inquiet de savoir que tous ces autobus-là qui vont passer, j’aitout lu à l’extérieur, ça va augmenter la pollution, puis ça va abîmer l’environnement.",fr
441,M. ZAVIN DARAKJIAN,J’aimerais savoir – ma question – est-ce qu’il y a des rapports de l’arrondissement par ledépartement de la santé publique?,fr
442,LA PRÉSIDENTE,"Monsieur Rainville, pour cette question?",fr
443,M. GAËTAN RAINVILLE,"Bien, on a fait faire effectivement des études sur la qualité de l'air, j’en parlaisprécédemment.",fr
444,M. GAËTAN RAINVILLE,"Maintenant, je ne peux pas répondre de façon spécifique à savoir si lesétudes ont porté sur l’environnement immédiat qui vous préoccupe, Monsieur.",fr
445,M. GAËTAN RAINVILLE,"Maintenant,je sais qu’on a présenté notre projet aux gens de santé – comment ça s’appelle",fr
446,M. GAËTAN RAINVILLE,"et qui sont, eux, très favorables",fr
447,M. GAËTAN RAINVILLE,parce que même s’il y a ungrand,fr
448,M. GAËTAN RAINVILLE,"nombre d’autobus, il y a un effet de diminution par une diminution du nombred’automobiles.",fr
449,M. GAËTAN RAINVILLE,"Écoutez, je ne suis pas ni technicien, ni ingénieur en qualité de l'air, maisce qu’on m’expliquait, c’est que c’est un effet qui se diffuse relativement rapidement dansl’atmosphère.",fr
450,M. GAËTAN RAINVILLE,Je ne vous en dirai pas plus parce que je ne veux pas m’avancer sur desterrains que je ne connais pas.,fr
451,LA PRÉSIDENTE,que vous envisagez d’autres précisions à cet égard-là?,fr
452,M. GAËTAN RAINVILLE,"Bien, je vais demander, je pense que Réjean a peut-être un complément deréponse.",fr
453,M. RÉJEAN DUROCHER,"Madame la Présidente, de plus en plus, il y a des nouveaux carburants qui sontutilisés dans les autobus et si on regarde avec la RTL ou quoi que ce soit, ils utilisent cescarburants.",fr
454,M. RÉJEAN DUROCHER,"Et, de plus en plus, ils deviennent abordables et ils pourraient être utilisés.",fr
455,M. RÉJEAN DUROCHER,"Donc, effectivement, on va en tenir compte.",fr
456,M. RÉJEAN DUROCHER,quand même où on veut ledéveloppement durable.,fr
457,M. RÉJEAN DUROCHER,"Donc, à cet égard-là, on va en tenir compte.",fr
458,LA PRÉSIDENTE,C’est en considération actuellement dans vos cartons.,fr
459,LA PRÉSIDENTE,Ça répond à votre question?,fr
460,M. ZAVIN DARAKJIAN,"Comme c'est montré dans les échelles ici que ça va ouvrir le chemin des ruescomme elles étaient avant, mais là, il y a un plan de bâtir un corridor pour les autobus, ceserait comme un mur de Berlin, O.K.?",fr
461,M. ZAVIN DARAKJIAN,"Ça va être tout bloqué, ça.",fr
462,M. ZAVIN DARAKJIAN,Comment on va êtrecapable de traverser la Bonaventure de 8 lanes?,fr
463,LA PRÉSIDENTE,Monsieur Rainville ou un de vos experts?,fr
464,M. GAËTAN RAINVILLE,"Écoutez, la circulation va demeurer fluide sur les artères, sur les ruesqui traversent à la fois le corridor Bonaventure et le corridor Dalhousie.",fr
465,M. GAËTAN RAINVILLE,"Il y a un ajout defeux de circulation à toutes les intersections, de telle sorte que le corridor d'autobus deDalhousie à chacune des intersections, soit à Brennan, soit à Ottawa, à William et ensuitede ça à Notre-Dame, il y a des feux de circulation à chacun des endroits.",fr
466,M. GAËTAN RAINVILLE,Et on a prisgrand soin justement d’éloigner le corridor de façon à s’assurer de la sécurité des piétonsqui emprunteront les passages sous le viaduc du Canadien National.,fr
467,M. GAËTAN RAINVILLE,"Alors ça ne sera pas comme vous le suggérez, comme monsieur le suggère,congestionné par un passage ininterrompu d’autobus.",fr
468,M. GAËTAN RAINVILLE,Il y a des feux de circulation quivont permettre de traverser ça.,fr
469,LA PRÉSIDENTE,Ça répond à votre question?,fr
470,LA PRÉSIDENTE,"J’inviterais madame Caroline Côté, s'il vous plaît.",fr
471,LA PRÉSIDENTE,Madame CarolineCôté est-elle dans la salle?,fr
472,LA PRÉSIDENTE,J’inviterais alors monsieur Jeffrey Dungen.,fr
473,M. JEFFREY DUNGEN,"Moi, je promène mon chien tous lessoirs, comme j’ai fait ce soir avant de venir ici, mais j’habite juste à côté, j’habite dans lesLowney qui est à l’ouest du corridor Dalhousie, de la rue Dalhousie, et je le promènejusqu’au parc à chiens qui se retrouve au coin de Duke et Brennan.",fr
474,M. JEFFREY DUNGEN,"Alors, si vousconnaissez un petit peu le coin, vous pouvez voir que je passe pas mal à travers tout deuxfois par jour pour me rendre et pour retourner.",fr
475,M. JEFFREY DUNGEN,"Quand j’y passe présentement, je traverse où les autobus passent actuellement.",fr
