,speaker,sentence,lang
151,M. GAËTAN RAINVILLE,"Soit dit enpassant, l’exemple qui a été donné par monsieur Hakim concernant l’échangeur avenuedu Parc et avenue des Pins est quand même un énorme succès des gens de la Ville deMontréal qui ont procédé à ces travaux-là.",fr
152,M. GAËTAN RAINVILLE,"Maintenant, juste à titre de précision, je suis sûr que non, la Ville de Montréal nepasse pas par une société pour avoir plus de facilité à octroyer les contrats à qui que cesoit.",fr
153,LA PRÉSIDENTE,"Je vous remercie, Monsieur Rainville.",fr
154,M. ROLAND HAKIM,"Je voudrais juste préciser que le 45 M$, c’est des transferts qui ont été effectués etapprouvés par le conseil exécutif de la Ville de Montréal à la Société du Havre.",fr
155,M. ROLAND HAKIM,"Cet argent620là est inscrit dans les minutes de réunions du conseil exécutif et dans deux jours, c'est-àdire jeudi, nous allons apporter la liste de ces transferts-là et nous allons les déposer à lacommission et nous allons laisser sur la table à l’avant des copies pour les journalistes etles participants qui veulent savoir d’où on a apporté ce chiffre de 45 M$.",fr
156,LA PRÉSIDENTE,Je rappelle que toute l’information est de toute façon déposée sur le site web.,fr
157,LA PRÉSIDENTE,"Non, l’information que vous apporterez.",fr
158,M. ROLAND HAKIM,mais la Société du Havre n’a jamais montré ses états financiers.,fr
159,M. ROLAND HAKIM,C’est del’argent du peuple avec lequel il travaille.,fr
160,LA PRÉSIDENTE,Je vous rappelle qu’on est en séance d’information et qu’on doit s’en tenir à desquestions.,fr
161,LA PRÉSIDENTE,"Je vous remercie, Monsieur Hakim.",fr
162,M. GAËTAN RAINVILLE,"Est-ce qu’on peut donner un complément de réponse, Madame la Présidente?",fr
163,LA PRÉSIDENTE,", s'il vous plaît.",fr
164,M. GAËTAN RAINVILLE,"C’est que là, ce qui a été voté par la Ville de Montréal, c’est des règlementsd’emprunt en prévision des travaux qui vont être faits ultérieurement.",fr
165,M. GAËTAN RAINVILLE,"Et là, il y a un20,5 M$ qui a été voté à l’été 2008, mais il ne s’agit d’aucun transfert au moment présent.",fr
166,M. GAËTAN RAINVILLE,"Et même au moment présent où on se parle, la Société du Havre de Montréal a quelquesmillions en banque en réserve sur les argents qui nous ont déjà été consentis par la Villede Montréal.",fr
167,LA PRÉSIDENTE,Je vous remercie de cette précision-là.,fr
168,LA PRÉSIDENTE,"J’appellerais maintenant, monsieur DinuBumbaru, s'il vous plaît.",fr
169,LA PRÉSIDENTE,"J’en profite, en attendant monsieur Bumbaru, pour vous dire qu’ilreste quelques places libres dans le milieu de la salle pour les gens qui sont debout àl’arrière.",fr
170,M. DINU BUMBARU,"On va essayer d’être court sur les préambules, c’est bien clair dans votreintroduction.",fr
171,M. DINU BUMBARU,"Dinu Bumbaru, Héritage Montréal.",fr
172,M. DINU BUMBARU,On s’intéresse au patrimoine et àl’urbanisme.,fr
173,M. DINU BUMBARU,"On s’intéresse aussi à l’efficacité des processus de consultation – c’est uneobservation –, une salle pleine comme ça, il y en avait une pour le projet du quadrilatèreSaint-Laurent et on n’est pas sûr que ça ait eu l’effet donc, on était bien heureuxd’entendre madame Hudon dire que les gens seront entendus, parce que c'est un projetqui le mérite.",fr
174,M. DINU BUMBARU,"Pour nous, on a regardé un peu.",fr
175,M. DINU BUMBARU,On a deux questions à poser.,fr
176,M. DINU BUMBARU,"Je peux vous lesprésenter une après l’autre, mais en général, c’est un projet qu’on va devoir regarder avecbeaucoup d’envergure parce que ce n’est pas qu’un projet d’un quelconque corridor ici etlà, c’est une polarité du centre-ville qui est traitée à travers ça et ce qu’on regarde, c’estaussi bien les impacts locaux que sur le cœur de la métropole.",fr
177,M. DINU BUMBARU,On a vu le cas Griffintownduquel on peut tirer énormément de leçons sur la façon dont on peut abstraire un projet deson contexte urbain.,fr
178,M. DINU BUMBARU,Une première qui touche au patrimoine.,fr
179,M. DINU BUMBARU,"Et il y a dans cesecteur notamment affecté par le projet du corridor d’autobus, l’ensemble de la New CityGas qui est un petit peu l’ancêtre d’Hydro-Québec.",fr
180,M. DINU BUMBARU,"C’est le lieu fondateur de la révolutionde la lumière, comme disait David Hanna.",fr
181,M. DINU BUMBARU,C'est l’usine à gaz qui est à la source un peudes corporations sur l’énergie.,fr
182,M. DINU BUMBARU,"On propose d’installer un passage, un corridor d’autobusdont on nous a vanté le potentiel de revitalisation.",fr
183,M. DINU BUMBARU,"Le thème de la revitalisation est souventemployé, il est très rarement défini, et comme on a posé la même question pour leQuadrilatère Saint-Laurent, on aimerait comprendre comment ce projet va, en fait,contribuer à la revitalisation du patrimoine, notamment de la New City Gas qui est unensemble absolument remarquable.",fr
184,M. DINU BUMBARU,"Et on a vu des études, enfin d’ingénierie, qui parlentde risque faible au niveau des vibrations, mais peut-être qu’au niveau des vibrations, çapeut avoir un effet que des ingénieurs, pas toujours familiers avec le patrimoine, saurontévaluer dans le bon sens, mais au niveau de la revitalisation, on aimerait savoir commentest-ce que ça va aider?",fr
185,M. DINU BUMBARU,"Et quelle est la promesse de voir le viaduc ferroviaire transformédans les magnifiques arcades berlinoises qu’on nous vante si bien, alors que le CN nesemble pas être à la table.",fr
186,LA PRÉSIDENTE,C’est votre première question.,fr
187,M. DINU BUMBARU,C’est notre première question.,fr
188,M. DINU BUMBARU,", on va la faire en vrac, comme ça, ça sera mieux relié.",fr
189,M. DINU BUMBARU,La deuxième est d’ordrede l’aménagement.,fr
190,M. DINU BUMBARU,"Comme beaucoup de Montréalais, on lit le journal à l’occasion et puislà, on apprend que derrière vous, devant nous, ici, se trouve la gare Windsor avec unprojet impressionnant de redéploiement des infrastructures ferroviaires, de transportcollectif, les pôles d’accès au centre-ville d’un transport public, on parle d’investissementsprivés de plusieurs centaines de millions.",fr
191,M. DINU BUMBARU,"Et donc, nécessairement, ça va poser laquestion de l’inscription du projet qui nous est mis dans une dynamique plus large, pasjuste les bons vieux arguments de relier le Vieux-Montréal avec le centre-ville qui est unproblème qui a été en bonne partie réglé par le Quartier international.",fr
192,M. DINU BUMBARU,"On aimerait savoir, est-ce qu’il y a un plan d’ensemble?",fr
193,M. DINU BUMBARU,"qu’aujourd'hui, cen’est pas clair l’objet de la consultation.",fr
194,M. DINU BUMBARU,"C’est une corporation non municipale quivolontairement – on le souligne et on l’apprécie – apporte un projet ici, maiséventuellement, il devra y avoir un cadre réglementaire qui s’inscrira, et quelqu’un vadevoir assumer la cohérence sur un territoire plus large que juste celui des beauxpaysages qu’on nous montre.",fr
195,M. DINU BUMBARU,Est-ce qu’il y a un cadre général?,fr
196,LA PRÉSIDENTE,"... le projet à l’intérieur d’un cadre plus général, où s’inscrivent d’autres projetscomme celui de la gare Windsor.",fr
197,M. DINU BUMBARU,"Oui, notamment, puisque ce sont des thématiques très semblables qui nousapparaissent",fr
198,M. DINU BUMBARU,"Alors, on aimerait comprendre ces aspects-là, ça nous aidera pour fairenotre mémoire.",fr
199,LA PRÉSIDENTE,"Monsieur Rainville, ce peut être vous comme un de vos collaborateurségalement qui réponde à l’une et l’autre question.",fr
200,M. GAËTAN RAINVILLE,Je vais amorcer un début de réponse à monsieur Bumbaru et je vaisdemander à monsieur Stéphane Conant du Service central de la Ville de Montréal àl’urbanisme de compléter ma réponse.,fr
201,M. GAËTAN RAINVILLE,"Alors, au niveau de la réalisation de la rue Dalhousie, c'est-à-dire du corridorexclusif pour transport collectif sur Dalhousie et de son passage immédiatement voisin ducomplexe",fr
202,LA PRÉSIDENTE,Souhaitez-vous que monsieur Conant ajoute un complément à la premièrequestion?,fr
203,M. STÉPHANE CONANT,"En fait, on l’a mentionné au début de la présentation, ce projet est unevision.",fr
204,M. STÉPHANE CONANT,"En fait, ce qu’on regarde ce soir, c'est une vision de développement pour laquelle iln’y a pas d’outils réglementaires encore qui sont développés dans la mesure où ces outilslà pourront être élaborés avec l’arrivée des projets immobiliers concrets qui seront par lasuite étudiés par la Ville et qui feront également l’objet de mesures, en fait, de démarchesde consultation appropriées, selon la nature des projets immobiliers qui seront envisagés.",fr
205,M. STÉPHANE CONANT,"Maintenant, monsieur Bumbaru évoquait également d’autres projets en périphériedu projet Bonaventure, des projets pour lesquels on a uniquement des idéesembryonnaires pour l’instant.",fr
206,M. STÉPHANE CONANT,"On a vu des choses dans les journaux, mais il n’y a pas dedémarches de planification ou d’encadrement précis qui sont amorcés par la Ville sur cesprojets-là.",fr
207,LA PRÉSIDENTE,"La révision du Plan d'urbanisme, c'est 2010.",fr
208,M. STÉPHANE CONANT,"mais la démarche de planification va s’amorcer dans les mois,",fr
209,M. STÉPHANE CONANT,"Dans les mois qui viennent, donc voilà.",fr
210,M. DINU BUMBARU,On va suivre un petit peu.,fr
211,M. DINU BUMBARU,Peut-être que ça serait bon que les images soient unpeu plus correspondantes.,fr
212,M. DINU BUMBARU,"Je vous avoue, ça donne un peu une confusion parce que plusles bâtiments sont hauts, plus la caméra monte.",fr
213,M. DINU BUMBARU,"Alors, on ne voit finalement jamaisl’impact réel sur les piétons.",fr
214,LA PRÉSIDENTE,J’aurais ici de la part de Jean-Claude Boisvert unequestion complémentaire à monsieur Conant.,fr
215,"M. JEAN-CLAUDE BOISVERT, commissaire","Monsieur Conant, je n’ai pas tout à fait bien compris lorsque vous avez parlé ducadre réglementaire qui serait établi au moment du développement.",fr
216,"M. JEAN-CLAUDE BOISVERT, commissaire","Mais est-ce qu’il seraétabli à la pièce ou est-ce qu’il y aura un règlement d’ensemble qui viendra garantir, si onveut, que le projet avec tous ses objectifs sera respecté par les promoteurs?",fr
217,M. STÉPHANE CONANT,Il est certain que le projet qu’on étudie ce soir va établir la vision d'ensemble.,fr
218,M. STÉPHANE CONANT,"Maintenant, les outils d’urbanisme qui devront être développés devront s’adapter auterritoire particulier qu’on connaît ici.",fr
219,M. STÉPHANE CONANT,"On est à la limite de deux arrondissements, en fait.",fr
220,M. STÉPHANE CONANT,Le territoire a cette particularité que les îlots qu’on pourra construire sont à cheval surdeux arrondissements.,fr
221,M. STÉPHANE CONANT,"Donc, il y aura nécessairement un outil réglementaire qui devraveiller à harmoniser la réglementation des deux arrondissements et il est difficile de prévoirce soir quel outil réglementaire sera le plus approprié, par quelle extrémité du projet lespremiers projets immobiliers arriveront.",fr
222,M. STÉPHANE CONANT,"Donc, c'est une fois qu’on aura identifié le premierprojet qu’on pourra établir la séquence et identifier l’outil réglementaire le plus approprié.",fr
223,M. STÉPHANE CONANT,Il y a différents outils qui sont envisageables.,fr
224,M. STÉPHANE CONANT,"On connaît la mécanique desrèglements en vertu de l’article 89, il y a les programmes particuliers d’urbanisme aussi quipeuvent être envisagés, mais il y a un gros défi d’harmonisation réglementaire qui vadevoir déterminer l’outil choisi pour la planification du site dans le respect de la vision quiest établie et qui, en fait, qui sera définie au terme de la consultation publique.",fr
225,"M. JEAN-CLAUDE BOISVERT, commissaire","La question aussi s’applique à une vision plus globale du territoire, de l’ensembledu territoire dans lequel se situe le projet.",fr
226,"M. JEAN-CLAUDE BOISVERT, commissaire","Et est-ce que ce cadre réglementaire là, vousparliez tantôt de la révision du Plan d'urbanisme, mais est-ce que ce cadre réglementairelà sera établi préalablement aux interventions qui sont effectuées par les promoteurs?",fr
227,LA PRÉSIDENTE,"Je vous remercie, Monsieur Conant.",fr
228,LA PRÉSIDENTE,"J’appellerais maintenant monsieur ÉricMichaud, s'il vous plaît.",fr
229,M. ÉRIC MICHAUD,! Ma question s'adresserait à monsieur Rainville.,fr
230,M. ÉRIC MICHAUD,Vous disiez tout à l’heuredans votre présentation que votre projet visait à respecter l'ensemble des politiquesmunicipales.,fr
231,M. ÉRIC MICHAUD,"Bon, moi, il y en a deux qui m’intéressent particulièrement.",fr
232,M. ÉRIC MICHAUD,C’est la politiqued’inclusion de logements abordables dans les nouveaux projets résidentiels et la politiquefamiliale que vous avez mentionnée.,fr
233,M. ÉRIC MICHAUD,Au niveau de la politique d’inclusion de logements abordables.,fr
234,M. ÉRIC MICHAUD,On sait que lastratégie – on l’appelle une stratégie plutôt qu’une politique,fr
235,M. ÉRIC MICHAUD,"– elle prévoit un minimum,dans les grands projets de développement immobilier résidentiel, un minimum de 15 % delogements sociaux.",fr
236,M. ÉRIC MICHAUD,"Après ça, ça peut se moduler en fonction des besoins sur lesterritoires où les projets se développent, mais donc un minimum de 15 % de logementssociaux dans ces projets-là.",fr
237,M. ÉRIC MICHAUD,"Si on analyse votre projet, on parle d’un projet de 2800 unités approximativement.",fr
238,M. ÉRIC MICHAUD,"Si je fais le calcul rapidement, ça s’établit à peu près à un minimum donc de 420 unités delogements sociaux dans le projet.",fr
239,M. ÉRIC MICHAUD,"J’aimerais savoir où ces logements vont être situés,d’une part.",fr
240,M. ÉRIC MICHAUD,"Et au niveau de la politique familiale, je regardais aussi les chiffres que vousavanciez, on parle de 2800 logements pour 5000 nouveaux résidants.",fr
241,M. ÉRIC MICHAUD,"Ça, en moyenne, çafait",fr
242,M. ÉRIC MICHAUD,"1,7 résidant par unité de logement",fr
243,M. ÉRIC MICHAUD,Ça ne m’apparaît pas beaucoup.,fr
244,M. ÉRIC MICHAUD,"On sait qu’on ades petites familles de nos jours mais là, on tombe dans le lilliputien.",fr
245,M. ÉRIC MICHAUD,"J’aimerais savoir comment vous voyez ça aussi, parce que je pense que c'est au-delà de60 % des unités qui seront dédiées à des logements pour personne seule et le logementfamilial, si je regardais aussi les gammes de prix qui étaient prévues au moins pour lescondominiums, on parle de condominiums qui s’adressent, pour les deux chambres àcoucher et plus, à des ménages qui font près de 100 000 $ par année en montant.",fr
246,M. ÉRIC MICHAUD,"Donc làencore, au niveau de la mixité, comment vous voyez ça?",fr
247,M. GAËTAN RAINVILLE,"Voilà, je vais faire un préambule de réponse très rapide et puis je vaisdemander à monsieur Bernard Cyr, qui est chef de division, responsable de l’applicationdes politiques de logement social et abordable à la Ville de Montréal de compléter maréponse.",fr
248,M. GAËTAN RAINVILLE,"Premièrement, nous avons tenu en septembre dernier, plusieurs séances deconcertation auxquelles nous avions convié différents groupes, dont les groupes qui sepréoccupent beaucoup, justement, de l’application de cette politique de la Ville deMontréal et c'est un sujet qui a été beaucoup discuté à l’époque.",fr
249,M. GAËTAN RAINVILLE,"Et l’engagement avait étépris auprès de ces gens-là, d’aussitôt le projet adopté et démarré en termes deconstruction et de travaux, de former un comité avec les gens impliqués dans ce dossier-làpour qu’on puisse regarder ensemble comment on va l’appliquer sur ce territoire-là.",fr
250,M. GAËTAN RAINVILLE,"Maintenant, quand on regarde les 2800 logements dont on parle ici, il y a à peuprès entre 800 et 1000 logements qui seraient spécifiquement dans le corridor desquadrilatères qui vont être rendus libres suite à la démolition de l’autoroute.",fr
251,M. GAËTAN RAINVILLE,"Les autressont des logements qui vont être construits en application du zonage actuel dans la zonepériphérique, notamment dans l’îlot de la Commune, c'est-à-dire où se trouve actuellementla cour de voirie de l’arrondissement Ville-Marie, et aussi dans le nord du quartier desRécollets, du Faubourg des Récollets.",fr
252,M. GAËTAN RAINVILLE,Et c'est là que se retrouveront la majorité desnouveaux logements.,fr
253,M. GAËTAN RAINVILLE,"Alors, je vais demander à monsieur Cyr de compléter la réponsequant à où et quant à la moyenne, par exemple, pour l’application de la stratégie depolitique familiale.",fr
254,M. BERNARD CYR,"La Stratégie d’inclusion que la Ville a adoptée, ça vise dans des projets dedéveloppement résidentiel de 200 logements et plus qui nécessitent des modificationsréglementaires.",fr
255,M. BERNARD CYR,"Comme ici, il n’y a pas... là où le corridor d'autoroute où on va construire,ce sont des terrains qui appartiennent à la Ville, des terrains municipaux.",fr
256,M. BERNARD CYR,Donc c’estévident qu’on va appliquer la stratégie de la Ville sur ces terrains-là.,fr
257,M. BERNARD CYR,"Sur 1000 logements,ça veut dire 15 % de logement social financé par les programmes gouvernementaux, 15 %de logement abordable privé que les gens peuvent acheter et bénéficier d’une aide àl’accession à la propriété de la Ville de Montréal.",fr
258,M. BERNARD CYR,"Mais comme monsieur Rainville disait, il y a les 1800 autres logements qui vont seconstruire sur les terrains périphériques, ce sont des terrains pour lesquels le zonageactuellement permet différentes fonctions, dont l’habitation.",fr
259,M. BERNARD CYR,"Donc, il n’y a pas demodification réglementaire sur ces projets-là nécessairement.",fr
260,M. BERNARD CYR,"Bien évidemment, si lespromoteurs veulent des modifications réglementaires, à ce moment-là, dans un processuspublic, on peut exiger l’inclusion de la Stratégie d’inclusion.",fr
261,M. BERNARD CYR,"Mais autrement, ce qu’on peutconfirmer, c’est que oui sur les terrains municipaux, il va y avoir l’inclusion.",fr
262,M. BERNARD CYR,Les projets nesont pas définis au moment où on se parle parce qu’on n’en est pas rendu au stade de laplanification fine.,fr
263,M. BERNARD CYR,"La Ville aussi a l’intention d’appliquer sa stratégie sur la politiquefamiliale, donc il va y avoir des produits pour familles, sauf qu’il reste à voir, ce n’est pasdéfini exactement comment ou sous quelle forme, ça reste à venir.",fr
264,M. BERNARD CYR,"Pour la densité d’occupation 1,7, malheureusement, je n’ai peut-être pas participéavec la Société du Havre sur la définition des produits, mais moi je dirais – et ils pourrontcompléter – c’est des pieds carrés qui ont été transposés en typologie moyenne qui apeut-être des deux chambres à coucher, mais tout ça, ça peut varier.",fr
265,M. BERNARD CYR,"n’est pas encore tout défini et puis sûrement qu’il va y avoir unintérêt à intégrer dans ces projets-là des logements, si les aménités viennent avec lesproduits pour famille, les produits pour toute typologie, mixité de clientèle.",fr
266,M. BERNARD CYR,"Donc, oncherche une mixité.",fr
267,M. BERNARD CYR,"Dans un projet de 1000 logements et plus, c’est évident qu’il faut qu’ily ait une mixité de clientèle.",fr
268,LA PRÉSIDENTE,"Je vous remercie, Monsieur Cyr.",fr
269,LA PRÉSIDENTE,"Ça répond à vos questions, Monsieur Michaud?",fr
270,M. ÉRIC MICHAUD,Est-ce que je pourrais amener une question complémentaire?,fr
271,LA PRÉSIDENTE,J’aimerais mieux pas parce qu’on est très nombreux.,fr
272,M. ÉRIC MICHAUD,"C'est que le 15 %, c’est vrai qu’il s’applique à des projetsconcrets de 200 logements et plus qui amènent des modifications réglementaires, mais ils’applique aussi à l'ensemble – ça, c’est un objectif du Plan d'urbanisme de la Ville deMontréal, de produire à l’intérieur de l’ensemble du développement immobilier résidentielsur le territoire de la Ville, 15 % de logements sociaux à l’intérieur de ça.",fr
273,M. ÉRIC MICHAUD,"Or, ce qu’onconstate, c'est que dans le centre-ville, on a tendance toujours à ramener ce ratio-là très àla baisse et il me semble que dans un projet de cette envergure-là, on ne devrait pas justese concentrer...",fr
274,LA PRÉSIDENTE,"Je suis obligée de vous arrêter, on est en séance d’information.",fr
275,LA PRÉSIDENTE,"Je vous remercie, Monsieur Michaud.",fr
276,LA PRÉSIDENTE,"J’appellerais monsieur Major, s'il vous plaît,Guy Major.",fr
277,LA PRÉSIDENTE,"appellerai alors monsieur David Hanna, s’il vous plaît.",fr
278,M. DAVID HANNA,"Ma première question, c’est justement par rapport à ce fameuxsondage qu’évoque monsieur Rainville, que si on demandait qu’est-ce que le New CityGas, personne ne saurait de quoi il s'agit aujourd'hui.",fr
279,M. DAVID HANNA,"Je présume qu’un même sondage ily a un demi-siècle exactement, en 59, aurait révélé la même ignorance par rapport à laMaison Du Calvet ou la Maison Papineau, par exemple, Vieux-Montréal, sans doute.",fr
280,M. DAVID HANNA,Rainville nous a confié durant sa présentation que le promoteur Devimcoproposait justement de mettre en valeur ce bâtiment du New City Gas dans son projet.,fr
281,M. DAVID HANNA,"Maquestion donc était qu’en tant que bon gestionnaire, est-ce que monsieur Rainville, luiaurait-il passé par la tête de commander une étude patrimoniale justement sur ce bâtimentdu New City Gas pour combler cette lacune flagrante de culture et de savoir par rapport aubâtiment, l’histoire fondamentale de",fr
282,M. DAVID HANNA,... une telle étude de commandée?,fr
283,LA PRÉSIDENTE,C’est votre seule question?,fr
284,M. DAVID HANNA,"J’ai une deuxième, mais sur un autre sujet.",fr
285,LA PRÉSIDENTE,", préférez-vous répondre immédiatement à cette premièrequestion?",fr
286,M. GAËTAN RAINVILLE,"Dans le cours des études que nous avons faites dans l’avant-projet détaillé,nous avons effectivement commandé une étude sur tout ce qui pouvait être d’ordred’intérêt patrimonial dans le secteur visé.",fr
287,M. GAËTAN RAINVILLE,"Alors, on voulait faire identifier par des expertsquels étaient les vestiges, les bâtiments existants à mettre en valeur, dont le New CityGas.",fr
288,M. GAËTAN RAINVILLE,"Maintenant, ce n’est pas une étude exhaustive qui a pris bâtiment par bâtiment, saufque ça nous a vraiment éclairés sur les précautions que nous devrions prendre pourmettre en valeur des bâtiments et surtout pour ne pas les abîmer ou les détruire.",fr
289,M. DAVID HANNA,"C'est pour ça que vous mettez un tunnel en béton droit devant la façade, bon.",fr
290,LA PRÉSIDENTE,Je vous demanderais d’éviter les commentaires et je demanderais...,fr
291,LA PRÉSIDENTE,– je demanderais également à l’assistance de retenir ses émotionspuisqu’on est en séance d’information publique.,fr
292,LA PRÉSIDENTE,Monsieur Hanna pour la suite?,fr
293,M. DAVID HANNA,"Alors, ma deuxième question, Madame la Présidente, c’est pour maintenantcombler un peu mon ignorance à moi.",fr
294,M. DAVID HANNA,"Par rapport au corridor Dalhousie, justement, il y aeu cette étude qu’on a vue sur le site des 7 corridors potentiels et cette étude a étécommandée par une firme externe.",fr
295,M. DAVID HANNA,"Je me demande pourquoi à aucun moment,semblerait-il, l’AMT, à qui normalement on confie les études d’autobus ou des passagesd'autobus, de financement et de planification du trafic autobus, n’a été mandatée pourjustement faire cette étude sur quel serait le corridor optimal d’autobus?",fr
296,LA PRÉSIDENTE,"Cette question appartient plutôt à notre troisième séance de consultation le 1erdécembre qui traitera du transport, étant donné qu’on est très nombreux ce soir.",fr
297,M. DAVID HANNA,"Alors, je la mets en réserve dans ce cas-là.",fr
298,LA PRÉSIDENTE,"... de mettre en réserve, s'il vous plaît.",fr
299,M. DAVID HANNA,J’attendrai patiemment le 1er décembre.,fr
300,LA PRÉSIDENTE,"Je vous remercie, Monsieur Hanna.",fr
301,MME SOPHIE THIEBAUT,"Je vais me limiter à deux questions, je passerai les soirs suivants.",fr
302,MME SOPHIE THIEBAUT,Ma première question est au sujet du caractère de développement durable dont onnous a parlé tantôt.,fr
303,MME SOPHIE THIEBAUT,Je voudrais savoir en quoi ce projet réduit la circulation automobile.,fr
304,LA PRÉSIDENTE,Est-ce que vous préférez poser vos deux questions?,fr
305,MME SOPHIE THIEBAUT,"ai une autre question après, mais comme monsieur Hanna, ça n’a pas rapportavec la réduction de la circulation automobile en période de réduction des gaz à effet deserre.",fr
306,LA PRÉSIDENTE,pour répondre à la première question?,fr
307,M. GAËTAN RAINVILLE,"Lorsque je parlais dans la présentation au tout début du fait que la démolitionde l’autoroute et la reconstruction des deux artères, soit Duke et de Nazareth à 4 voies decirculation, on passait de 12 voies à 8.",fr
308,LA PRÉSIDENTE,"Votre deuxième question, Madame Thiebaut?",fr
309,MME SOPHIE THIEBAUT,"Enfin, je voudrais juste préciser qu’il me semble que ça ne répond pas à maquestion.",fr
310,MME SOPHIE THIEBAUT,À partir du 65 000 véhicules...,fr
311,LA PRÉSIDENTE,Je vous inviterais à passer à votre seconde question pour garder la périodecommentaires au mémoire.,fr
312,MME SOPHIE THIEBAUT,Ça n’a pas répondu à ma question.,fr
