,file,speaker,sentence,lang
254,citizen_sub_8a39,LETTER,"Montréal croit que la conservation, le bon usage et l’enrichissement du patrimoine montréalais vont de pair avec des processus qui assurent l’élaboration et la réalisation de projets fondés sur les principes de pertinence, d’innovation, d’adaptation aux réalités urbaines et d’exemplarité en matière de développement urbain, d’architecture et de gestion.",fr
255,citizen_sub_8a39,LETTER,", Héritage Montréal œuvre au maintien du patrimoine et de l’identité des quartiers montréalais.",fr
256,citizen_sub_8a39,LETTER,Le patrimoine du Canal de Lachine – un lieu historique national – et de ses quartiers industriels et ouvriers limitrophes possède une grande valeur.,fr
257,citizen_sub_8a39,LETTER,"À Griffintown, elle s’exprime dans le cadastre, le tracé et le nom des rues, les constructions, les grands arbres, autant que dans les usages traditionnels, les sites archéologiques connus ou à découvrir et les vues (vers l’eau, la ville, la montagne ou des repères monumentaux comme les silos ou autres éléments du panorama industriels).",fr
258,citizen_sub_8a39,LETTER,"Cependant, plusieurs endroits sont négligés ou déstructurés et certains complexes industriels patrimoniaux, comme l’ancienne brasserie Dow, posent d’importants défis de reconversion.",fr
259,citizen_sub_8a39,LETTER,"Montréal reconnaît donc, comme le Plan d’urbanisme, le potentiel réel du secteur pour une intervention immobilière contemporaine qui tiennent compte du patrimoine urbain, de la capacité limite du site et de son environnement urbain.",fr
260,citizen_sub_8a39,LETTER,"Informé d’un projet par la société Devimco pour le secteur délimité par les rues du Séminaire, Ottawa, Ann et le bassin Peel du Canal de Lachine, Héritage",fr
261,citizen_sub_8a39,LETTER,"Montréal a préparé la présente note qui exprime certains principes directeurs pour un tel développement, prenant pour base les principes endossés par notre Assemblée générale.",fr
262,citizen_sub_8a39,LETTER,Nous espérons ainsi contribuer à l’établissement d’un dialogue qui aidera à l’élaboration et à la mise en œuvre d’un projet exemplaire dans l’atteinte des objectifs d’excellence et d’innovation en urbanisme et développement durable que recherchent l’ensemble des intervenants.,fr
263,citizen_sub_8a39,LETTER,", conserver et revitaliser le patrimoine du secteur dans la diversité de ses expressions afin de tirer partie de son caractère identitaire (cadastre, trame de rues, toponymie, ensembles, bâtiments, ouvrages de génie civil, vues, archéologie).",fr
264,citizen_sub_8a39,LETTER,"Élaborer un concept d’aménagement qui permette d’intensifier et de densifier le secteur en préservant son caractère par la diversité du bâti (architecture, matériaux, époques, Projet de réaménagement de l’autoroute Bonaventure (",fr
265,citizen_sub_8a39,LETTER,Phase 1) Mémoire d’Héritage,fr
266,citizen_sub_8a39,LETTER,Montréal présenté à l’Office de consultation publique de Montréal le 19 janvier 2010,fr
267,citizen_sub_8a39,LETTER,", par l’échelle de quartier (proximité, promenabilité, parcours, rues, domaine public) et par la mixité des usages (diversité commerciale, commerce sur rue).",fr
268,citizen_sub_8a39,LETTER,"Intégrer le projet à son cadre urbain élargi en termes d’aménagement, d’impact visuel, de parcours et de déplacements en tenant compte des autres secteurs d’intérêt ou en revitalisation tel que l’axe Peel, le Vieux-Montréal/Cité du Multimédia, Pointe Saint-Charles, projet de réaménagement de l’autoroute Bonaventure ou du site Postes Canada, et le secteur du marché Atwater.",fr
269,citizen_sub_8a39,LETTER,"Ce projet soulève des questions de nature fondamentale sur le choix d’un modèle de revitalisation et de développement pour un quartier ancien de grand intérêt dont les limites de sa capacité d’accueil, eu égard à ses dimensions patrimoniales et urbaines, doivent être reconnues.",fr
270,citizen_sub_8a39,LETTER,"Il met également en lumière la complexité de parcours d’un tel projet dans l’état actuel de la gouvernance à Montréal en matière d’aménagement, d’urbanisme et de patrimoine.",fr
271,citizen_sub_8a39,LETTER,"Tout en reconnaissant l’existence et la pertinence de processus publics et statutaires de consultation pour un développement urbain d’une telle envergure,",fr
272,citizen_sub_8a39,LETTER,"Montréal est disposé à collaborer avec les promoteurs, leurs professionnels et les instances municipales pour la mise en œuvre de ces principes directeurs dans le cadre du projet et ce, dans le court comme dans le long terme.",fr
273,citizen_sub_8a39,LETTER,"Héritage Montréal, le 9 octobre 2007 Projet de réaménagement de l’autoroute Bonaventure (Phase 1) Mémoire d’Héritage",fr
274,citizen_sub_8a39,LETTER,Montréal présenté à l’Office de consultation publique de Montréal le 19 janvier 2010,fr
275,citizen_sub_8a39,LETTER,D. Meilleurs vœux pour un développement urbain de qualité en 2010 Texte publié dans Le Devoir le 30 décembre 2009,fr
276,citizen_sub_8a39,LETTER,"En cette fin 2009, il est difficile de passer à côté d’immenses sujets comme l’économie ou la conférence de Copenhague sur le climat, De ces événements planétaires se dégage une perception de vulnérabilité ou de cynisme face à un marchandage entre intérêts politiques qui correspond de moins en moins au besoin d’engagement authentique et de véritables solutions au service du bien commun.",fr
277,citizen_sub_8a39,LETTER,Il en va de même à l’échelle de Montréal et de ses quartiers où l’on recherche aussi un nouvel équilibre SAVOIR / DEVOIR / POUVOIR pour un modèle de développement responsable envers la prochaine génération et satisfaisant pour la société actuelle.,fr
278,citizen_sub_8a39,LETTER,Notre défi commun est de protéger autant que d’enrichir notre patrimoine en poursuivant l’aventure des bâtisseurs de villes comme Montréal.,fr
279,citizen_sub_8a39,LETTER,"Ce défi est lancé aux autorités comme aux entreprises, organismes et citoyens.",fr
280,citizen_sub_8a39,LETTER,"À Montréal, 2010 sera une année propice à relever ce défi.",fr
281,citizen_sub_8a39,LETTER,"Né comme d’autres associations à une époque où le développement urbain reposait sur les infrastructures lourdes et sur la démolition massive du centre-ville et des quartiers, Héritage",fr
282,citizen_sub_8a39,LETTER,"Adopté en 2004, le Plan d’urbanisme de Montréal devra être mis à jour avec le rétablissement d’un Service d’urbanisme qu’on souhaite compétent et autonome pour bien éclairer et appliquer les décisions.",fr
283,citizen_sub_8a39,LETTER,"2010 marquera aussi le 5e anniversaire de la politique du patrimoine de la Ville de Montréal, une première parmi les grandes métropoles, et du classement du mont Royal par le gouvernement du Québec, acte remarquable dont on s’attend qu’il amène une protection crédible au-dessus des marchandages ordinaires.",fr
284,citizen_sub_8a39,LETTER,"Montréal transmet donc ses meilleurs vœux pour qu’en 2010, on cherche, on trouve et on réalise les actions nécessaires pour amener un modèle de développement urbain dont on sera collectivement les actionnaires et les fiduciaires.",fr
285,citizen_sub_8a39,LETTER,"Au gouvernement fédéral, nous souhaitons qu’il aide les propriétaires de bâtiments patrimoniaux par la fiscalité incitative dont il n’a jamais réalisé la promesse.",fr
286,citizen_sub_8a39,LETTER,Qu’il se fasse le promoteur d’une reconnaissance internationale de la valeur universelle de l’ensemble patrimonial de Montréal.,fr
287,citizen_sub_8a39,LETTER,"Qu’il assume dignement son héritage en restaurant la maison de Sir Louis-Hippolyte Lafontaine, témoin abandonné des émeutes de 1849 associées à l’avènement du gouvernement responsable au Canada.",fr
288,citizen_sub_8a39,LETTER,"Au gouvernement du Québec, nous souhaitons d’exercer sa compétence de protecteur du patrimoine comme l’y engage sa Loi sur le développement durable.",fr
289,citizen_sub_8a39,LETTER,"Qu’il cesse de reporter ses promesses de moderniser ses lois et de les appliquer et fasse de la mise en valeur du patrimoine historique et culturel dont les paysages, une assise identitaire du développement du territoire et des communautés.",fr
290,citizen_sub_8a39,LETTER,Nous lui souhaitons aussi de mieux reconnaître la réalité montréalaise.,fr
291,citizen_sub_8a39,LETTER,Qu’il libère la métropole du conflit d’intérêt permanent que lui impose une fiscalité dominée par l’immobilier.,fr
292,citizen_sub_8a39,LETTER,"Qu’il délivre ses élus de la tentation constante de négliger les consultations et déroger à leurs règles d’urbanisme pour accorder à des promoteurs privés ou institutionnels, des privilèges injustifiés au plan de l’intérêt collectif ou de l’exigence de qualité.",fr
293,citizen_sub_8a39,LETTER," À la Ville de Montréal, nous souhaitons de consacrer 2010 à rétablir son lien de confiance avec la population et sa cohérence, conditions essentielles au progrès de la métropole.",fr
294,citizen_sub_8a39,LETTER,"Après avoir encouragé et promu sans discernement des projets immobiliers dérogatoires ou médiocres sous prétexte de lutter contre l’immobilisme ou la crise économique, Montréal et ses arrondissements ont maintenant le devoir de faire respecter de véritables principes Projet de réaménagement de l’autoroute Bonaventure (Phase 1) Mémoire d’Héritage",fr
295,citizen_sub_8a39,LETTER,Montréal présenté à l’Office de consultation publique de Montréal le 19 janvier 2010,fr
296,citizen_sub_8a39,LETTER,– p. 16d’aménagement et de mise en valeur du patrimoine et du territoire.,fr
297,citizen_sub_8a39,LETTER,Qu’ils s’engagent aussi à respecter les consultations Héritage,fr
298,citizen_sub_8a39,LETTER,"Montréal souhaite aussi aux Montréalais de prendre le temps de découvrir et de connaître Montréal, ses quartiers, son patrimoine pour mieux apprécier l’aventure des bâtisseurs de la métropole et les défis de sa revitalisation et de son progrès à quelques années de son 375e anniversaire en 2017.",fr
299,citizen_sub_8a39,LETTER,Nous les encourageons aussi à s’engager activement.,fr
300,citizen_sub_8a39,LETTER,"Que leurs gestes personnels – repeindre ses escaliers, aider une association, participer à une consultation publique – continuent de garder à Montréal et à ses quartiers leur personnalité unique.",fr
301,citizen_sub_8a39,LETTER,"Que leurs valeurs s’expriment pour contribuer à définir une vision montréalaise du développement urbain fondée sur l’identité urbaine, la dimension humaine et l’innovation, éléments qui font tant défaut à d’autres agglomérations qui n’existent que par la magie abstraite des statistiques ou des clichés, En 2010, on ne pourra plaider l’ignorance.",fr
302,citizen_sub_8a39,LETTER,Le savoir sera au rendez-vous.,fr
303,citizen_sub_8a39,LETTER,Souhaitons que le sens du devoir y soit.,fr
304,citizen_sub_8a39,LETTER,"On pourra ainsi s’engager sur la voie d’un développement urbain de qualité grâce à des projets pertinents, conçus avec créativité en tenant compte du contexte et du patrimoine suivant des démarches exemplaires, et dont l’architecture comme le bénéfice urbain dureront longtemps.",fr
305,citizen_sub_8a39,LETTER,Joyeuses fêtes et meilleurs vœux!,fr
306,citizen_sub_8a39,LETTER,"Robert Turgeon, Président du Conseil d’administration",fr
307,citizen_sub_8a39,LETTER,"Dinu Bumbaru, Directeur des politiques Héritage",fr
308,citizen_sub_8a39,LETTER,"Montréal Montréal, le 24 décembre 2009 Projet de réaménagement de l’autoroute Bonaventure (",fr
309,citizen_sub_8a39,LETTER,Phase 1) Mémoire d’Héritage,fr
310,citizen_sub_8a39,LETTER,Montréal présenté à l’Office de consultation publique de Montréal le 19 janvier 2010,fr
