,file,speaker,sentence,lang
137,citizen_sub_8a39,LETTER,Les rapports indiquent notamment la découverte d’indices ou d’éléments associés à quelques trois siècles d’histoire montréalaise dont le canal des Sulpiciens du XVIIe siècle ou le jardin de leur Collège du XIXe siècle.,fr
138,citizen_sub_8a39,LETTER,"Considérant l’intérêt du projet pour les espaces publics et l’art public, il serait pertinent voire stimulant d’explorer le potentiel de mise en valeur de la mémoire du sol.",fr
139,citizen_sub_8a39,LETTER,Enjeux d’aménagement et de paysage urbain Héritage,fr
140,citizen_sub_8a39,LETTER,Montréal reçoit avec intérêt la volonté de la Société du Havre de faire une « entrée de ville qui propulsera Montréal dans le 21ième siècle » mais trouve difficile de réconcilier cette visée inspirante avec la proposition d’ériger un mur de tours dont la pertinence et la qualité sont incertaines.,fr
141,citizen_sub_8a39,LETTER,"En fait, nous considérons que la proposition d’un tel alignement de gratte-ciel dans l’axe de la rue University constitue l’élément le plus problématique du projet de réaménagement de l’autoroute Bonaventure.",fr
142,citizen_sub_8a39,LETTER,Il semble d’abord refléter un objectif spéculatif de la Ville de Montréal dans ce dossier et non une vision Projet de réaménagement de l’autoroute Bonaventure (Phase 1) Mémoire d’Héritage,fr
143,citizen_sub_8a39,LETTER,Montréal présenté à l’Office de consultation publique de Montréal le 19 janvier 2010,fr
144,citizen_sub_8a39,LETTER,– p. 7créative d’amélioration de l’expérience urbaine digne d’une métropole culturelle comme prétend l’être Montréal.,fr
145,citizen_sub_8a39,LETTER,"Actuellement, l’autoroute a un caractère d’obstacle qui tient surtout au fait que son utilisation est exclusive au transport automobile et que les espaces sous son tablier n’ont fait l’objet d’aucun usage ou aménagement qui contribue à l’expérience urbaine et au patrimoine collectif – tout au contraire!",fr
146,citizen_sub_8a39,LETTER,– mais il ne s’agit pas là d’une situation qu’on ne pourrait améliorer.,fr
147,citizen_sub_8a39,LETTER,"Par contre, la présence de cette infrastructure assure une percée visuelle remarquable depuis la terrasse Dorchester et la présence d’une large ouverture vers le ciel entre des quartiers – Faubourg aux Récollets et Griffintown – qui sont appelés à se densifier et ainsi, à voir le paysage de leurs rues se refermer.",fr
148,citizen_sub_8a39,LETTER,"Dans son état actuel, la proposition de la Société du Havre est en rupture avec la promesse de plus de 20 ans de réaménager l’autoroute en entrée de ville sous forme d’un boulevard urbain, une approche qui servirait mieux l’intérêt collectif en dégageant les vues et en créant un mail central bien encadré de nouveaux édifices apte à accueillir un ambitieux programme d’art public.",fr
149,citizen_sub_8a39,LETTER,"Au lieu de cela, la proposition actuelle dégage des sites à bâtir pour servir les intérêts spéculatifs de projets immobiliers qui obstrueraient de façon permanente, la trame de l’espace urbain entre les secteurs de Place Ville-Marie et de l’entrée du canal de Lachine et les vues au loin et vers des repères comme la montagne, le dôme de la Cathédrale, l’ancien siège de la Banque Royale, la Tour de la Bourse, le silo 5 ou l’enseigne Farine Five Roses.",fr
150,citizen_sub_8a39,LETTER,"Par ailleurs, Héritage Montréal craint que la promesse de rehausser la signature de Montréal « ville UNESCO de design » grâce à ces constructions, ne se matérialise pas.",fr
151,citizen_sub_8a39,LETTER,"Rien du projet actuel ne vise à prévenir la répétition d’un scénario selon lequel les décideurs, las de voir inutilisés ces terrains municipaux dégagés de façon aussi coûteuse, n’autorisent la réalisation de projets médiocres.",fr
152,citizen_sub_8a39,LETTER,On a vu à quel point le marché montréalais est capable de gaspiller ainsi des lieux emblématiques.,fr
153,citizen_sub_8a39,LETTER,"Autour du parc Lafontaine, rue Sherbrooke ou à l’entrée du chemin de la Côte Sainte-Catherine ou sur Côte-des-Neiges sur le mont Royal, des sites de haute visibilité ont été sacrifiés pour ériger des parois de balcons en béton et des architectures ordinaires qui, globalement, n’ont guère enrichi le patrimoine montréalais.",fr
154,citizen_sub_8a39,LETTER,Les formules usuelles et les clichés que constituent désormais les toits verts ou les gratifications de type LEED pour ces nouvelles constructions ne sauraient compenser ni justifier un tel sacrifice.,fr
155,citizen_sub_8a39,LETTER,Montréal appuie la proposition de la Société du Havre de créer un programme majeur d’art public dans le cadre du projet.,fr
156,citizen_sub_8a39,LETTER,"En fait, ce devrait être un élément principal d’une entrée de ville qui soit d’abord conçue et réalisée comme un espace public d’une architecture du paysage contemporaine soutenue par un programme majeur d’œuvres d’art sculptural ou environnemental accessibles en permanence.",fr
157,citizen_sub_8a39,LETTER,"Cela permettra de rehausser la contribution de ces arts à la réalité urbaine de Montréal – Métropole culturelle, un concept qui reste très associé à une définition de la culture fondée sur la consommation d’activités ou d’événements billetés plutôt que sur son urbanité.",fr
158,citizen_sub_8a39,LETTER,Projet de réaménagement de l’autoroute Bonaventure (,fr
159,citizen_sub_8a39,LETTER,Phase 1) Mémoire d’Héritage,fr
160,citizen_sub_8a39,LETTER,Montréal présenté à l’Office de consultation publique de Montréal le 19 janvier 2010,fr
161,citizen_sub_8a39,LETTER,"Montréal soutient en principe l’idée de réaménager l’espace occupé par l’autoroute Bonaventure pour rehausser sa qualité d’espace urbain accessible et animé, pour y installer des œuvres d’art de haute qualité dans le but doter le centreville de Montréal d’une entrée à la hauteur de sa prétention de métropole culturelle et pour améliorer l’expérience des usagers du lien de transport entre le centre-ville et la Rive Sud que des personnes qui, à l’occasion comme au quotidien, font l’expérience urbaine de ce secteur ancien.",fr
162,citizen_sub_8a39,LETTER,"Montréal est heureux de pouvoir participer à cette consultation de l’Office de consultation publique dont l’objectif est, selon les termes de la haute direction de la Société du Havre de Montréal, de bonifier cette proposition dont on comprend qu’elle est ouverte à des modifications même substantielle de son projet.",fr
163,citizen_sub_8a39,LETTER,"Au terme de notre analyse du projet qui nous a permis de cibler certains points encore préoccupants, nous formulons certaines recommandations et réitérons notre disponibilité pour contribuer – dans le cadre d’un processus crédible et organisé, à l’amélioration et à la réalisation d’un projet de réaménagement de l’autoroute Bonaventure qui soit un véritable projet de revitalisation, d’amélioration de l’expérience urbaine et d’enrichissement du patrimoine montréalais.",fr
164,citizen_sub_8a39,LETTER,"En premier lieu, le processus de planification du projet ne semble orienté que sur la réalisation des objectifs de rentabilité fiscale pour la Ville de Montréal.",fr
165,citizen_sub_8a39,LETTER,"Il ne sert pas d’abord la promesse de créer un lieu identitaire nouveau marquant l’entrée du centre-ville et contribuant à la revitalisation de cette partie négligée du cœur de la métropole et, en général, à l’expérience urbaine.",fr
166,citizen_sub_8a39,LETTER,"Alors que les documents évoquent la concertation comme valeur, le projet reste centré sur ses intérêts et son territoire, sans vision de revitalisation urbaine en relation avec les secteurs environnants ni préoccupation pour les impacts qu’il aurait sur ceux-ci comme le démontre la proposition du corridor d’autobus sur la rue Dalhousie peu sensibles aux conséquences qu’elle imposerait à un secteur où la Ville a attiré des investisseurs pour créer un milieu de vie.",fr
167,citizen_sub_8a39,LETTER,Recommandations sur le processus de planification à date et à venir :      Définir le projet dans une planification réaliste et à long terme du secteur Quartier international / Faubourg des Récollets / Bassin,fr
168,citizen_sub_8a39,LETTER,Peel / Gare Windsor qui garantisse la stabilité des paramètres réglementaires ou autres afin de réaliser cette vision;,fr
169,citizen_sub_8a39,LETTER,"Reconnaître la valeur des pionniers de la revitalisation du secteur soit les propriétaires patients (New City Gas), les artistes (Fonderie Darling) et les nouveaux résidents (Lowney) Évaluer objectivement la contribution supplémentaire du projet à la revitalisation urbaine du secteur et redéfinir le projet à cette fin;",fr
170,citizen_sub_8a39,LETTER,Concevoir et gérer les liens de transport collectif pour répondre à leurs objectifs propres tout en en faisant de vrais facteurs de revitalisation des quartiers traversés;,fr
171,citizen_sub_8a39,LETTER,Élaborer des solutions alternatives au corridor d’autobus proposé sur la rue Dalhousie pour assurer la qualité de la déserte sans nuire aux quartiers riverains Projet de réaménagement de l’autoroute Bonaventure (,fr
172,citizen_sub_8a39,LETTER,Phase 1) Mémoire d’Héritage,fr
173,citizen_sub_8a39,LETTER,Montréal présenté à l’Office de consultation publique de Montréal le 19 janvier 2010,fr
174,citizen_sub_8a39,LETTER,"9 Mettre en place un véritable mécanisme de planification concertée crédible et organisé selon les règles de l’art (mandat et indépendance des responsables, efficacité et impact sur la formulation du projet)",fr
175,citizen_sub_8a39,LETTER,suite à la présente consultation dans le but notamment d’assurer la mise en œuvre des recommandations de l’Office de consultation publique.,fr
176,citizen_sub_8a39,LETTER,"En deuxième lieu, la prise en compte du patrimoine reste lacunaire.",fr
177,citizen_sub_8a39,LETTER,Le projet n’avance pas de mesures concrètes convaincantes pour prévenir la dégradation ou la perte de sites patrimoniaux majeurs dont la New City Gas,fr
178,citizen_sub_8a39,LETTER,l’ancienne forge Cadieux ou l’édifice,fr
179,citizen_sub_8a39,LETTER,ni pour mettre en valeur le patrimoine archéologique qui pourrait être révélé lors des travaux.,fr
180,citizen_sub_8a39,LETTER,Recommandations pour améliorer la prise en compte du patrimoine :    Définir la conservation et la mise en valeur des bâtiments patrimoniaux du secteur dont la New City Gas,fr
181,citizen_sub_8a39,LETTER,", la forge Cadieux, l’édifice Rodier et le viaduc-entrepôt du CN, comme éléments du projet de réaménagement et du mandat de planification;",fr
182,citizen_sub_8a39,LETTER,"Élaborer de concert avec les propriétaires de ces édifices, des stratégies spécifiques et des propositions concrètes et réalisables de revitalisation et de mise en valeur en priorisant la forge Cadieux et la New City Gas",fr
183,citizen_sub_8a39,LETTER,Définir les mesures de mise en valeur de la mémoire du sol et de l’archéologie du site.,fr
184,citizen_sub_8a39,LETTER,La prétention du projet d’amener une amélioration majeure du paysage urbain et une signature architecturale contemporaine constitue un objectif valable,fr
185,citizen_sub_8a39,LETTER,Cet objectif doit cependant être complété de garanties convaincantes pour aller au-delà des bonnes intentions ce qui ne semble pas encore le cas.,fr
186,citizen_sub_8a39,LETTER,"D’une part, le projet aura un impact majeur sur les qualités d’ouverture et les vues du paysage urbain dans ce secteur compte tenu de l’importante quantité de volume bâti pour satisfaire des intérêts spéculatifs de la Ville de Montréal davantage que l’amélioration de l’expérience urbaine et de l’entrée de ville.",fr
187,citizen_sub_8a39,LETTER,"La disposition de ces volumes bâtis depuis le premier édifice proposé au bord du canal de Lachine est problématique et créerait un obstacle et une barrière autrement plus lourde et conséquente que ne pourrait l’être l’actuelle autoroute, plutôt basse et poreuse mais dépourvue d’une intention autre qu’à titre d’infrastructure de transport.",fr
188,citizen_sub_8a39,LETTER,"D’autre part, la qualité architecturale promise reste tributaire de tiers qui ne sont pas liés par le présent exercice de consultation publique ni par les propos de la Société du Havre de Montréal.",fr
189,citizen_sub_8a39,LETTER,Ces bâtisseurs ne sont pas encore là pour assurer dès à présent que ce réaménagement constituera un enrichissement réel du patrimoine montréalais comme le furent les réaménagements de l’avenue McGill College ou du Quartier international.,fr
190,citizen_sub_8a39,LETTER,Rien ne semble garantir qu’elle sera au rendez-vous autrement que pour justifier la modification radicale du concept de réaménagement de l’autoroute imaginé depuis plus de 20 ans.,fr
191,citizen_sub_8a39,LETTER,L’intérêt financier de la Ville de Montréal dans un tel projet et l’absence d’une exigence incontournable en la matière nous préoccupent alors que l’administration montréalaise a démontré sa Projet de réaménagement de l’autoroute Bonaventure (Phase 1) Mémoire d’Héritage,fr
192,citizen_sub_8a39,LETTER,Montréal présenté à l’Office de consultation publique de Montréal le 19 janvier 2010,fr
193,citizen_sub_8a39,LETTER,– p. 10tendance à favoriser des réalisations souvent médiocres pour satisfaire son appétit statistique et fiscal au détriment de l’excellence en développement urbain.,fr
194,citizen_sub_8a39,LETTER,Recommandations pour améliorer le bénéfice urbain du projet :,fr
195,citizen_sub_8a39,LETTER,"     Redéfinir le projet en fonction d’objectifs de requalification de l’espace du tronçon de l’autoroute pour y créer un espace public longitudinal qui accueillerait le programme d’art public, bordé par d’éventuelles constructions assujetties à des exigences fermes de qualité architecturale;",fr
196,citizen_sub_8a39,LETTER,"Réduire substantiellement la quantité et la disposition du volume bâti proposé pour prévenir la création d’un effet de muraille, maintenir un dégagement central dans l’emprise de l’autoroute et dégager les abords du canal de Lachine;",fr
197,citizen_sub_8a39,LETTER,"Assujettir toute proposition de nouveau bâtiment pour maintenir et valoriser les vues depuis l’intersection René-Lévesque / University et depuis les quartiers du Faubourg des Récollets ou de Griffintown vers des repères dont la montagne, le dôme de la Cathédrale, l’ancien siège de la Banque Royale, la Tour de la Bourse, le silo 5 ou l’enseigne Farine Five Roses;",fr
198,citizen_sub_8a39,LETTER,"Établir une charte d’exigences incontournables assurant la pertinence,",fr
199,citizen_sub_8a39,LETTER,la qualité architecturale et la contribution de toute nouvelle construction sur ce secteur à la qualité de l’expérience urbaine et au patrimoine montréalais Confier l’application de ces règles et exigences à une instance compétente en la matière et indépendante des intérêts financiers de la Ville de Montréal.,fr
200,citizen_sub_8a39,LETTER,"Les défis complexes de requalification, de revitalisation et d’aménagement que pose le site de l’autoroute Bonaventure sont communs à d’autres métropoles.",fr
201,citizen_sub_8a39,LETTER,Ils touchent l’identité et l’expérience urbaine tout comme la fonctionnalité des villes et de leurs régions à l’ère du développement durable.,fr
202,citizen_sub_8a39,LETTER,Montréal invite donc la Société du Havre de Montréal et la Ville de Montréal à s’inspirer du succès de réalisations récentes – Viaduc des Arts et Promenade plantée (Paris);,fr
203,citizen_sub_8a39,LETTER,High Line (New York).,en
204,citizen_sub_8a39,LETTER,"Comme le Quartier international de Montréal, ces exemples illustrent comment l’innovation est possible en misant sur la réalisation d’espaces publics de très haute qualité plutôt que sur un bâti spéculatif irréaliste.",fr
205,citizen_sub_8a39,LETTER,"Ils montrent aussi la valeur d’opérations de réanimation d’espaces résiduels sous des infrastructures de transport et la réappropriation de leurs tabliers surélevés en lieux d’architecture nouvelle qui offrent un regard nouveau aux citoyens, visiteurs et investisseurs pour valoriser la ville et des secteurs à revitaliser comme celui-ci.",fr
206,citizen_sub_8a39,LETTER,"Pour tirer le meilleur parti du site de l’autoroute Bonaventure, Héritage",fr
207,citizen_sub_8a39,LETTER,Montréal croit qu’il faille s’interdire de le gaspiller au profit de projets ordinaires ou techniques dont la rentabilité ne serait qu’économique et à courte vue.,fr
208,citizen_sub_8a39,LETTER,"Au contraire, ce réaménagement doit illustrer le modèle montréalais de développement urbain, un modèle fondé sur une culture de la ville comme espace collectif et sur l’exigence de réaliser des projets pertinents et novateurs qui enrichissent le patrimoine de Montréal suivant l’exemple des bâtisseurs du parc du Mont-Royal, du Vieux Port ou de la place Jean-Paul Riopelle.",fr
209,citizen_sub_8a39,LETTER,"Il faut concevoir, réaliser et entretenir un espace remarquable dont les Montréalais seront heureux et fiers au point d’en devenir les gardiens pour leur plaisir comme pour leurs enfants ou leurs hôtes.",fr
210,citizen_sub_8a39,LETTER,"À Montréal, le 19 janvier Projet de réaménagement de l’autoroute Bonaventure (Phase 1) Mémoire d’Héritage",fr
211,citizen_sub_8a39,LETTER,Montréal présenté à l’Office de consultation publique de Montréal le 19 janvier 2010,fr
212,citizen_sub_8a39,LETTER,"à Joël Gauthier, président-directeur général de l’Agence métropolitaine de transport (",fr
213,citizen_sub_8a39,LETTER,"26 février 2009) Monsieur le Président-directeur général, Héritage Montréal a été informé d’un projet de relocalisation sur la rue Dalhousie, du couloir d’autobus reliant le centre-ville de Montréal à la Rive Sud à l’occasion du projet de réaménagement de l’autoroute Bonaventure qu’élabore la Société du Havre de Montréal pour la Ville de Montréal.",fr
214,citizen_sub_8a39,LETTER,"Évoqué depuis plus de 20 ans, le rabaissement de l’autoroute Bonaventure améliorerait la porte principale au centre-ville, au Vieux Montréal et à ses faubourgs.",fr
215,citizen_sub_8a39,LETTER,Il devrait faire l’objet de consultations publiques et nous comptons aider à le bonifier à cette occasion.,fr
216,citizen_sub_8a39,LETTER,"Toutefois, nous nous préoccupons d’entendre que le couloir d’autobus serait exclu de ces consultations malgré les importants impacts négatifs du déversement d’un flux massif d’autobus",fr
217,citizen_sub_8a39,LETTER,"on évoque le chiffre de 1400 passages par jour – sur la conservation et la revitalisation des bâtiments patrimoniaux du secteur, notamment l’ensemble de la New City Gas",fr
218,citizen_sub_8a39,LETTER,", complexe industriel des années 1850 dont le projet Griffintown révéla l’importance.",fr
219,citizen_sub_8a39,LETTER,"Sur la base de nos principes (ci-joint), nous vous demandons de retirer le projet de couloir sur la rue Dalhousie et d’intégrer toute proposition alternative pour ce lien majeur de transport collectif à la consultation publique sur le projet de la Société du Havre.",fr
220,citizen_sub_8a39,LETTER,"Vous assurant de notre disponibilité à collaborer à cet effet, nous vous transmettons, monsieur le Président-directeur général, nos salutations urbaines.",fr
221,citizen_sub_8a39,LETTER,"Le directeur des politiques, Dinu Bumbaru c.c.",fr
222,citizen_sub_8a39,LETTER,"Raymond Bachand, ministre responsable de Montréal Julie Boulet, ministre des transports Gérald Tremblay, ‘Maire de Montréal André Lavallée, vice-président du Comité exécutif de Montréal Jacqueline Montpetit, mairesse de l’arrondissement du Sud Ouest Marie Lessard, présidente du Conseil du patrimoine de Montréal Gaétan Rainville, directeur général de la Société du Havre de Montréal Lise Noël, présidente de l’Association québécoise pour le patrimoine industriel",fr
223,citizen_sub_8a39,LETTER,Cinq principes pour un véritable développement urbain de qualité à Montréal (28 janvier 2008),fr
224,citizen_sub_8a39,LETTER,Projet de réaménagement de l’autoroute Bonaventure (,fr
225,citizen_sub_8a39,LETTER,Phase 1) Mémoire d’Héritage,fr
226,citizen_sub_8a39,LETTER,Montréal présenté à l’Office de consultation publique de Montréal le 19 janvier 2010,fr
227,citizen_sub_8a39,LETTER,présidente de la Société du Havre de Montréal (29 juin 2009),fr
228,citizen_sub_8a39,LETTER,"Madame la Présidente, Le 18 juin dernier, nous avons assisté avec intérêt à l’annonce que la Société du Havre de Montréal et le Maire de Montréal faisaient du projet Quartier Bonaventure.",fr
229,citizen_sub_8a39,LETTER,"D’emblée, nous tenons à vous féliciter devant la volonté manifeste d’améliorer cette entrée principale du centre-ville qui se dégage de cette annonce et l’espoir qu’elle apporte d’une réalisation concrète.",fr
230,citizen_sub_8a39,LETTER,"Il y a 25 ans, Héritage",fr
231,citizen_sub_8a39,LETTER,Montréal intervenait pour que le réaménagement de l’avenue McGill,fr
232,citizen_sub_8a39,LETTER,Collège soit aujourd’hui un atout incontestable pour la métropole.,fr
233,citizen_sub_8a39,LETTER,"En 1986, nous appuyions le projet de la Ville de Montréal de transformer l’autoroute Bonaventure en boulevard urbain.",fr
234,citizen_sub_8a39,LETTER,"Récemment, nous participions aux démarches pour réaménager l’intersection",fr
235,citizen_sub_8a39,LETTER,"Parc / Pins en y rétablissant un espace urbain humain, rendant un accès visuel et piéton à la montagne au lieu de l’échangeur.",fr
236,citizen_sub_8a39,LETTER,"Ces succès témoignent d’un modèle montréalais fondé sur la participation réelle des citoyens et des organismes comme Héritage Montréal à une démarche de planification bénéficiant du temps, de la détermination et des talents nécessaires.",fr
237,citizen_sub_8a39,LETTER,"Ces conditions seront aussi essentielles au succès durable du réaménagement de l’autoroute Bonaventure, projet pour lequel nous avons déjà souligné notre enthousiasme aux représentants de la Société du Havre.",fr
238,citizen_sub_8a39,LETTER,Il reste d’importants points à résoudre pour assurer ce succès et pour éviter de remplacer un obstacle poreux – l’actuelle autoroute surélevée – par d’autres plus conséquents comme pourraient l’être le corridor Dalhousie ou les gratte-ciels en lieu de boulevard urbain.,fr
239,citizen_sub_8a39,LETTER,Conscients de l’importance du lien de transport collectif Centre-ville /,fr
240,citizen_sub_8a39,LETTER,", nous nous préoccupons de votre « recommandation » de transférer l’ensemble des flux d’autobus sur la rue Dalhousie, le long de l’ensemble patrimonial de la New City Gas",fr
241,citizen_sub_8a39,LETTER,Cette recommandation nous apparaît toujours irrecevable et nous apprécions que d’autres scénarios soient étudiés.,fr
242,citizen_sub_8a39,LETTER,Nous notons aussi que le projet fera l’objet d’un exercice de l’Office de consultation publique pour en compléter la conception et pour assurer sa réalisation réussie.,fr
243,citizen_sub_8a39,LETTER,"Souhaitant vous rencontrer sous peu pour examiner les collaborations possibles, nous vous transmettons, madame la Présidente, nos salutations urbaines les plus distinguées.",fr
244,citizen_sub_8a39,LETTER,"Le directeur des politiques, Dinu Bumbaru c.c.",fr
245,citizen_sub_8a39,LETTER,"M. Gérald Tremblay, Maire de Montréal Mme Marie Lessard, présidente du Conseil du patrimoine de Montréal M. Joël Gauthier, président-directeur général de l’Agence métropolitaine de transport Projet de réaménagement de l’autoroute Bonaventure (Phase 1) Mémoire d’Héritage",fr
246,citizen_sub_8a39,LETTER,Montréal présenté à l’Office de consultation publique de Montréal le 19 janvier 2010,fr
247,citizen_sub_8a39,LETTER,C. Projet de développement de Griffintown,fr
248,citizen_sub_8a39,LETTER,- Projet de principes directeurs (ébauche pour discussion – 9 octobre 2007),fr
249,citizen_sub_8a39,LETTER,Héritage Montréal a pour mission d’encourager la protection et la mise en valeur du patrimoine des collectivités de la métropole.,fr
250,citizen_sub_8a39,LETTER,"Nous réalisons cette mission en œuvrant à la connaissance, la reconnaissance, au bon usage et à l’enrichissement du patrimoine dans une perspective de développement durable qui tienne compte de l’intérêt collectif, des dimensions historiques et culturelles et de la participation des citoyens aux choix affectant la qualité de la ville.",fr
251,citizen_sub_8a39,LETTER,Montréal considère que Montréal et ses quartiers se distinguent par leur patrimoine bâti et par leur paysage urbain.,fr
252,citizen_sub_8a39,LETTER,"Cela résulte de l’apport collectif des générations successives de bâtisseurs privés, publics ou institutionnels.",fr
253,citizen_sub_8a39,LETTER,La revitalisation ou la transformation de la ville est aussi le fruit d’un tel processus diversifié.,fr
